{
  "schema_version": "1.0.0",
  "dataset_id": "access-review-demo-2026-09-21",
  "snapshot_at": "2026-09-21T00:00:00Z",
  "synthetic": true,
  "identities": [
    {
      "id": "id:person-0001",
      "username": "ada.bennett.0001",
      "name": "Ada Bennett",
      "department": "engineering",
      "role": "engineering-manager",
      "status": "active",
      "employment_type": "employee",
      "manager_id": null,
      "start_date": "2023-01-16",
      "end_date": null
    },
    {
      "id": "id:person-0002",
      "username": "alex.morgan.0002",
      "name": "Alex Morgan",
      "department": "engineering",
      "role": "software-engineer",
      "status": "active",
      "employment_type": "employee",
      "manager_id": "id:person-0001",
      "start_date": "2024-01-15",
      "end_date": null
    },
    {
      "id": "id:person-0003",
      "username": "zoe.bennett.0003",
      "name": "Zoë Bennett",
      "department": "engineering",
      "role": "software-engineer",
      "status": "active",
      "employment_type": "employee",
      "manager_id": "id:person-0001",
      "start_date": "2024-02-15",
      "end_date": null
    },
    {
      "id": "id:person-0004",
      "username": "casey.diaz.0004",
      "name": "Casey Diaz",
      "department": "engineering",
      "role": "software-engineer",
      "status": "active",
      "employment_type": "employee",
      "manager_id": "id:person-0001",
      "start_date": "2024-03-15",
      "end_date": null
    },
    {
      "id": "id:person-0005",
      "username": "chen.evans.0005",
      "name": "Chen Evans",
      "department": "engineering",
      "role": "software-engineer",
      "status": "active",
      "employment_type": "employee",
      "manager_id": "id:person-0001",
      "start_date": "2024-04-15",
      "end_date": null
    },
    {
      "id": "id:person-0006",
      "username": "dara.farah.0006",
      "name": "Dara Farah",
      "department": "engineering",
      "role": "software-engineer",
      "status": "active",
      "employment_type": "employee",
      "manager_id": "id:person-0001",
      "start_date": "2024-05-15",
      "end_date": null
    },
    {
      "id": "id:person-0007",
      "username": "emi.gray.0007",
      "name": "Emi Gray",
      "department": "engineering",
      "role": "software-engineer",
      "status": "active",
      "employment_type": "employee",
      "manager_id": "id:person-0001",
      "start_date": "2024-06-15",
      "end_date": null
    },
    {
      "id": "id:person-0008",
      "username": "finley.hayes.0008",
      "name": "Finley Hayes",
      "department": "engineering",
      "role": "software-engineer",
      "status": "active",
      "employment_type": "contractor",
      "manager_id": "id:person-0001",
      "start_date": "2026-06-01",
      "end_date": "2027-03-31"
    },
    {
      "id": "id:person-0009",
      "username": "harper.ibrahim.0009",
      "name": "Harper Ibrahim",
      "department": "engineering",
      "role": "software-engineer",
      "status": "active",
      "employment_type": "contractor",
      "manager_id": "id:person-0001",
      "start_date": "2026-09-20",
      "end_date": "2027-03-31"
    },
    {
      "id": "id:person-0010",
      "username": "ira.jordan.0010",
      "name": "Ira Jordan",
      "department": "engineering",
      "role": "software-engineer",
      "status": "on_leave",
      "employment_type": "employee",
      "manager_id": "id:person-0001",
      "start_date": "2024-09-15",
      "end_date": null
    },
    {
      "id": "id:person-0011",
      "username": "jules.kim.0011",
      "name": "Jules Kim",
      "department": "engineering",
      "role": "software-engineer",
      "status": "terminated",
      "employment_type": "employee",
      "manager_id": "id:person-0001",
      "start_date": "2024-10-15",
      "end_date": "2026-09-21"
    },
    {
      "id": "id:person-0012",
      "username": "kai.lane.0012",
      "name": "Kai Lane",
      "department": "engineering",
      "role": "software-engineer",
      "status": "pre_hire",
      "employment_type": "employee",
      "manager_id": "id:person-0001",
      "start_date": "2026-10-05",
      "end_date": null
    },
    {
      "id": "id:person-0013",
      "username": "lena.malik.0013",
      "name": "Lena Malik",
      "department": "finance",
      "role": "finance-manager",
      "status": "active",
      "employment_type": "employee",
      "manager_id": null,
      "start_date": "2023-01-16",
      "end_date": null
    },
    {
      "id": "id:person-0014",
      "username": "alex.morgan.0014",
      "name": "Alex Morgan",
      "department": "finance",
      "role": "financial-analyst",
      "status": "active",
      "employment_type": "employee",
      "manager_id": "id:person-0013",
      "start_date": "2024-01-15",
      "end_date": null
    },
    {
      "id": "id:person-0015",
      "username": "renee.nguyen.0015",
      "name": "Renée Nguyen",
      "department": "finance",
      "role": "financial-analyst",
      "status": "active",
      "employment_type": "employee",
      "manager_id": "id:person-0013",
      "start_date": "2024-02-15",
      "end_date": null
    },
    {
      "id": "id:person-0016",
      "username": "sam.reed.0016",
      "name": "Sam Reed",
      "department": "finance",
      "role": "financial-analyst",
      "status": "active",
      "employment_type": "employee",
      "manager_id": "id:person-0013",
      "start_date": "2024-03-15",
      "end_date": null
    },
    {
      "id": "id:person-0017",
      "username": "taylor.santos.0017",
      "name": "Taylor Santos",
      "department": "finance",
      "role": "financial-analyst",
      "status": "active",
      "employment_type": "employee",
      "manager_id": "id:person-0013",
      "start_date": "2024-04-15",
      "end_date": null
    },
    {
      "id": "id:person-0018",
      "username": "zuri.bennett.0018",
      "name": "Zuri Bennett",
      "department": "finance",
      "role": "financial-analyst",
      "status": "active",
      "employment_type": "employee",
      "manager_id": "id:person-0013",
      "start_date": "2024-05-15",
      "end_date": null
    },
    {
      "id": "id:person-0019",
      "username": "ada.brooks.0019",
      "name": "Ada Brooks",
      "department": "finance",
      "role": "financial-analyst",
      "status": "active",
      "employment_type": "employee",
      "manager_id": "id:person-0013",
      "start_date": "2024-06-15",
      "end_date": null
    },
    {
      "id": "id:person-0020",
      "username": "amir.carter.0020",
      "name": "Amir Carter",
      "department": "finance",
      "role": "financial-analyst",
      "status": "active",
      "employment_type": "contractor",
      "manager_id": "id:person-0013",
      "start_date": "2026-06-01",
      "end_date": "2027-03-31"
    },
    {
      "id": "id:person-0021",
      "username": "ana.diaz.0021",
      "name": "Ana Diaz",
      "department": "finance",
      "role": "financial-analyst",
      "status": "active",
      "employment_type": "contractor",
      "manager_id": "id:person-0013",
      "start_date": "2026-09-20",
      "end_date": "2027-03-31"
    },
    {
      "id": "id:person-0022",
      "username": "casey.evans.0022",
      "name": "Casey Evans",
      "department": "finance",
      "role": "financial-analyst",
      "status": "on_leave",
      "employment_type": "employee",
      "manager_id": "id:person-0013",
      "start_date": "2024-09-15",
      "end_date": null
    },
    {
      "id": "id:person-0023",
      "username": "chen.farah.0023",
      "name": "Chen Farah",
      "department": "finance",
      "role": "financial-analyst",
      "status": "terminated",
      "employment_type": "employee",
      "manager_id": "id:person-0013",
      "start_date": "2024-10-15",
      "end_date": "2026-09-21"
    },
    {
      "id": "id:person-0024",
      "username": "dara.gray.0024",
      "name": "Dara Gray",
      "department": "finance",
      "role": "financial-analyst",
      "status": "pre_hire",
      "employment_type": "employee",
      "manager_id": "id:person-0013",
      "start_date": "2026-10-05",
      "end_date": null
    },
    {
      "id": "id:person-0025",
      "username": "emi.hayes.0025",
      "name": "Emi Hayes",
      "department": "hr",
      "role": "hr-manager",
      "status": "active",
      "employment_type": "employee",
      "manager_id": null,
      "start_date": "2023-01-16",
      "end_date": null
    },
    {
      "id": "id:person-0026",
      "username": "finley.ibrahim.0026",
      "name": "Finley Ibrahim",
      "department": "hr",
      "role": "people-operations-specialist",
      "status": "active",
      "employment_type": "employee",
      "manager_id": "id:person-0025",
      "start_date": "2024-01-15",
      "end_date": null
    },
    {
      "id": "id:person-0027",
      "username": "harper.jordan.0027",
      "name": "Harper Jordan",
      "department": "hr",
      "role": "people-operations-specialist",
      "status": "active",
      "employment_type": "employee",
      "manager_id": "id:person-0025",
      "start_date": "2024-02-15",
      "end_date": null
    },
    {
      "id": "id:person-0028",
      "username": "ira.kim.0028",
      "name": "Ira Kim",
      "department": "hr",
      "role": "people-operations-specialist",
      "status": "active",
      "employment_type": "employee",
      "manager_id": "id:person-0025",
      "start_date": "2024-03-15",
      "end_date": null
    },
    {
      "id": "id:person-0029",
      "username": "jules.lane.0029",
      "name": "Jules Lane",
      "department": "hr",
      "role": "people-operations-specialist",
      "status": "active",
      "employment_type": "employee",
      "manager_id": "id:person-0025",
      "start_date": "2024-04-15",
      "end_date": null
    },
    {
      "id": "id:person-0030",
      "username": "kai.malik.0030",